{
  "$schema": "https://json-schema.org/draft/2020-12/schema",
  "title": "An environment's committed settings, infra/env/<env>.json (#295)",
  "description": "The public choices for one environment, which infra/main.bicepparam and the environment scripts read. Every setting infra/main.bicepparam reads is listed here, and x-usnm-visibility says where it lives: public, in the committed file; private, in the settings store (an App Configuration store shared by the subscription's environments) under the environment's label, and never in the repository; local, in the environment's local settings file, written by the scripts. A setting left out takes its default in infra/main.bicepparam. Checked by scripts/lib/env_settings.py --check.",
  "type": "object",
  "additionalProperties": false,
  "properties": {
    "$schema": {
      "type": "string",
      "description": "This schema, for editors: ./schema.json."
    },
    "AZURE_ENV_NAME": {
      "x-usnm-visibility": "local",
      "description": "Local: in the environment's local settings file. The environment's name, which the scripts set from --env.",
      "not": {}
    },
    "AZURE_LOCATION": {
      "x-usnm-visibility": "local",
      "description": "Local: in the environment's local settings file. The region, which scripts/azure/bootstrap.sh sets (see its --move).",
      "not": {}
    },
    "USNM_ALERT_EMAILS": {
      "x-usnm-visibility": "private",
      "description": "Private: in the settings store, under the environment's label. Alert recipients' email addresses.",
      "not": {}
    },
    "USNM_AMERICAN_STORIES": {
      "x-usnm-visibility": "public",
      "type": "boolean"
    },
    "USNM_AMERICAN_STORIES_SEARCH": {
      "x-usnm-visibility": "public",
      "type": "boolean"
    },
    "USNM_API_CERT_ID": {
      "x-usnm-visibility": "private",
      "description": "Private: in the settings store, under the environment's label. A managed certificate's resource id, which names the subscription.",
      "not": {}
    },
    "USNM_API_IMAGE": {
      "x-usnm-visibility": "public",
      "type": "string"
    },
    "USNM_API_IMAGE_TAG": {
      "x-usnm-visibility": "public",
      "type": "string",
      "pattern": "^[A-Za-z0-9_][A-Za-z0-9_.-]{0,127}$",
      "description": "API-only ACR tag; when omitted, follows USNM_IMAGE_TAG."
    },
    "USNM_API_MAX_REPLICAS": {
      "x-usnm-visibility": "public",
      "type": "integer",
      "minimum": 1,
      "description": "Maximum API replicas (default 2); divides the shared-searcher computation budget."
    },
    "USNM_ARCHIVE_ACCOUNT": {
      "x-usnm-visibility": "private",
      "description": "Private: in the settings store, under the environment's label. The archival account's resource id, which names its subscription.",
      "not": {}
    },
    "USNM_AVAILABILITY_FREQUENCY": {
      "x-usnm-visibility": "public",
      "type": "string"
    },
    "USNM_BACKFILL_CRON": {
      "x-usnm-visibility": "public",
      "type": "string"
    },
    "USNM_BACKFILL_WORKERS": {
      "x-usnm-visibility": "public",
      "type": "integer"
    },
    "USNM_BOINC_GROUP": {
      "x-usnm-visibility": "public",
      "type": "boolean"
    },
    "USNM_BOINC_CONTROLLER_ONPREM": {
      "x-usnm-visibility": "public",
      "description": "Let USNM_BOINC_HANDOFF_RUNNER (CT 211) run the BOINC batch controller (#866): Reader on the subscription and a role that updates and starts the hand-off and bridge jobs.",
      "type": "boolean"
    },
    "USNM_BOINC_SERVER_ONPREM": {
      "x-usnm-visibility": "public",
      "description": "The BOINC server runs on-prem (#942): skip the scan fetcher's reader grant on the BOINC Log Analytics workspace, which the on-prem server mode removes. Match \"server\" in contrib-compute/infra/boinc/env/<env>.json.",
      "type": "boolean"
    },
    "USNM_BOINC_HANDOFF_IMAGE": {
      "x-usnm-visibility": "public",
      "description": "The BOINC hand-off job's image (#469): images.bridge from contrib-compute/infra/boinc/env/<env>.json. Empty or unset: no hand-off job.",
      "type": "string",
      "pattern": "^$|^[a-z0-9]+\\.azurecr\\.io/usnm-boinc-bridge@sha256:[0-9a-f]{64}$"
    },
    "USNM_BOINC_HANDOFF_ONPREM": {
      "x-usnm-visibility": "public",
      "description": "Let USNM_BOINC_ONPREM_HOST run usnm-boinc claim and collect on-prem (#967 phase 3), with the hand-off job's grants: Cosmos ops, the ledger writer on curated, reader on reference, the node writer role on ocr-out, and Message Processor and Sender on the work queues. Pair it with USNM_COSMOS_ONPREM_ACCESS.",
      "type": "boolean"
    },
    "USNM_BOINC_ONPREM_HOST": {
      "x-usnm-visibility": "private",
      "description": "Private: in the settings store, under the environment's label. The on-prem BOINC host's own Arc machine identity's object id (usnm-boinc-arcs-<env>), with USNM_BOINC_HANDOFF_ONPREM.",
      "not": {}
    },
    "USNM_BOINC_HANDOFF_RUNNER": {
      "x-usnm-visibility": "private",
      "description": "Private: in the settings store, under the environment's label. The scan fetcher's identity's object id (the scan-fetch container's Arc machine identity, #469), which pushes scans to boinc-handoff.",
      "not": {}
    },
    "USNM_BROWSE_PAGES": {
      "x-usnm-visibility": "public",
      "type": "boolean"
    },
    "USNM_BUDGET_START": {
      "x-usnm-visibility": "public",
      "type": "string"
    },
    "USNM_COMPUTE_CONCURRENCY": {
      "x-usnm-visibility": "public",
      "type": "integer",
      "minimum": 1,
      "description": "Visitor computation budget per searcher (default 2); shared searchers allocate floor(budget / API max replicas) to each API replica."
    },
    "USNM_CONGRESS": {
      "x-usnm-visibility": "public",
      "type": "boolean"
    },
    "USNM_CONGRESS_JOB": {
      "x-usnm-visibility": "public",
      "type": "boolean"
    },
    "USNM_CONGRESS_SEARCH": {
      "x-usnm-visibility": "public",
      "type": "boolean"
    },
    "USNM_COSMOS_FREE_TIER": {
      "x-usnm-visibility": "public",
      "type": "boolean"
    },
    "USNM_COSMOS_ONPREM_ACCESS": {
      "x-usnm-visibility": "public",
      "description": "Open Cosmos DB to USNM_OCR_NODE_IPS (#967): public network access behind an IP firewall that allows those addresses only; the private endpoint stays and local auth stays off. No effect without USNM_OCR_NODE_IPS.",
      "type": "boolean"
    },
    "USNM_DEDICATED_PROFILE": {
      "x-usnm-visibility": "public",
      "type": "boolean"
    },
    "USNM_DNS_ZONE": {
      "x-usnm-visibility": "public",
      "type": "string"
    },
    "USNM_DNS_ZONE_HOSTED": {
      "x-usnm-visibility": "public",
      "type": "boolean"
    },
    "USNM_EXPERIMENT": {
      "x-usnm-visibility": "local",
      "description": "Local: in the environment's local settings file. dev's current experiment (an issue number), which scripts/azure/stand-up.sh sets and scripts/azure/teardown.sh clears.",
      "not": {}
    },
    "USNM_EXPERIMENT_STARTED": {
      "x-usnm-visibility": "local",
      "description": "Local: in the environment's local settings file. When dev's experiment started, which every provision of dev sets.",
      "not": {}
    },
    "USNM_GITHUB_REPO": {
      "x-usnm-visibility": "public",
      "type": "string"
    },
    "USNM_GITHUB_REPO_IDS": {
      "x-usnm-visibility": "private",
      "description": "Private: in the settings store, under the environment's label. The repository's owner and repository ids, which the CI identity's federated credentials trust.",
      "not": {}
    },
    "USNM_IMAGE_TAG": {
      "x-usnm-visibility": "local",
      "description": "Local: in the environment's local settings file. The image tag dev runs, which scripts/azure/stand-up.sh sets to the commit it builds; elsewhere the default (main).",
      "not": {}
    },
    "USNM_INDEX_STORAGE": {
      "x-usnm-visibility": "public",
      "type": "boolean",
      "description": "Stage rebuilds in the separate Quickwit account. Default false; keep on once created."
    },
    "USNM_INDEX_STORAGE_SERVE": {
      "x-usnm-visibility": "public",
      "type": "boolean",
      "description": "Switch the searcher to the separate account during the documented cutover. Requires USNM_INDEX_STORAGE."
    },
    "USNM_INGEST_CRON": {
      "x-usnm-visibility": "public",
      "type": "string"
    },
    "USNM_INGEST_FULL": {
      "x-usnm-visibility": "public",
      "type": "boolean"
    },
    "USNM_INGEST_JOBS": {
      "x-usnm-visibility": "public",
      "type": "boolean"
    },
    "USNM_INGEST_ON_DEDICATED": {
      "x-usnm-visibility": "public",
      "type": "boolean"
    },
    "USNM_INGEST_SCRATCH_GIB": {
      "x-usnm-visibility": "public",
      "type": "integer"
    },
    "USNM_JA_LATIN": {
      "x-usnm-visibility": "public",
      "type": "boolean"
    },
    "USNM_JA_OCR_JOB": {
      "x-usnm-visibility": "public",
      "type": "boolean"
    },
    "USNM_JA_OCR_ONPREM": {
      "x-usnm-visibility": "public",
      "description": "Run the Japanese OCR on-prem (#917): grants for the on-prem hosts' group and the data lake open to the node IPs. Pair with USNM_JA_OCR_JOB false.",
      "type": "boolean"
    },
    "USNM_JA_OCR_REPLICAS": {
      "x-usnm-visibility": "public",
      "type": "integer"
    },
    "USNM_LAKE_BLOB_SOFT_DELETE_DAYS": {
      "x-usnm-visibility": "public",
      "type": "integer",
      "minimum": 1,
      "maximum": 365,
      "description": "Default 3; restore 14 only after pruning the old lake index."
    },
    "USNM_LOG_DAILY_CAP_GB": {
      "x-usnm-visibility": "public",
      "type": "string"
    },
    "USNM_MERGE_TIMEOUT_SECS": {
      "x-usnm-visibility": "public",
      "type": "integer"
    },
    "USNM_OCR": {
      "x-usnm-visibility": "public",
      "type": "boolean"
    },
    "USNM_OCR_BULK_REFILL_BELOW": {
      "x-usnm-visibility": "public",
      "type": "string"
    },
    "USNM_OCR_BULK_WINDOW": {
      "x-usnm-visibility": "public",
      "type": "string"
    },
    "USNM_OCR_KEYVAULT_ADMINS": {
      "x-usnm-visibility": "private",
      "description": "Private: in the settings store, under the environment's label. Entra object ids given Key Vault Secrets Officer on the OCR nodes' vault.",
      "not": {}
    },
    "USNM_OCR_LOCAL": {
      "x-usnm-visibility": "public",
      "type": "boolean"
    },
    "USNM_OCR_NODES": {
      "x-usnm-visibility": "public",
      "type": "boolean"
    },
    "USNM_SCAN_ARCHIVE_UPLOADER_ID": {
      "x-usnm-visibility": "private",
      "description": "Private: scan-host Arc principal granted only archive writer access.",
      "not": {}
    },
    "USNM_SCAN_FETCH_PUBLISH_FETCHED": {
      "x-usnm-visibility": "public",
      "description": "Let USNM_BOINC_HANDOFF_RUNNER (the scan fetcher, pve-big CT 211) publish its fetched-scans list (#1056): the node writer role on ocr-out (list, read, create; no delete), for usnm-ocr-worker publish-fetched.",
      "type": "boolean"
    },
    "USNM_OCR_NODE_GROUP": {
      "x-usnm-visibility": "private",
      "description": "Private: in the settings store, under the environment's label. The OCR nodes' Entra group's object id.",
      "not": {}
    },
    "USNM_ONPREM_GROUP": {
      "x-usnm-visibility": "private",
      "description": "Private: in the settings store, under the environment's label. The object id of usnm-onprem-grp-<env>, every on-prem host's Arc identity (scripts/ocr-node/group.sh --kind onprem); it gets the roles any host needs for local work.",
      "not": {}
    },
    "USNM_OCR_NODE_IPS": {
      "x-usnm-visibility": "private",
      "description": "Private: in the settings store, under the environment's label. The OCR nodes' public IP addresses (the operator's home IP).",
      "not": {}
    },
    "USNM_OCR_SEED_BATCHES": {
      "x-usnm-visibility": "public",
      "type": "string"
    },
    "USNM_OCR_SEED_LANGUAGES": {
      "x-usnm-visibility": "public",
      "type": "string"
    },
    "USNM_OCR_SEED_MANIFEST": {
      "x-usnm-visibility": "public",
      "type": "string"
    },
    "USNM_OCR_SEED_MAX_PAGES": {
      "x-usnm-visibility": "public",
      "type": "string"
    },
    "USNM_OCR_SEED_MIN_DAMAGE": {
      "x-usnm-visibility": "public",
      "type": "string"
    },
    "USNM_OCR_SEED_PILOT": {
      "x-usnm-visibility": "public",
      "type": "string"
    },
    "USNM_OCR_SEED_PLAN": {
      "x-usnm-visibility": "public",
      "type": "string"
    },
    "USNM_OCR_SEED_SKIP_AMERICAN_STORIES": {
      "x-usnm-visibility": "public",
      "type": "string"
    },
    "USNM_OCR_SEED_SOURCE": {
      "x-usnm-visibility": "public",
      "type": "string"
    },
    "USNM_OCR_SEED_YEARS": {
      "x-usnm-visibility": "public",
      "type": "string"
    },
    "USNM_OCR_SKU": {
      "x-usnm-visibility": "public",
      "type": "string"
    },
    "USNM_OCR_SYNC_CRON": {
      "x-usnm-visibility": "public",
      "type": "string"
    },
    "USNM_OCR_USER_DAILY_MAX": {
      "x-usnm-visibility": "public",
      "type": "integer"
    },
    "USNM_OCR_USERS": {
      "x-usnm-visibility": "private",
      "description": "Private: in the settings store, under the environment's label. Entra principals given access to Document Intelligence.",
      "not": {}
    },
    "USNM_ONPREM_RELEASE": {
      "x-usnm-visibility": "public",
      "type": "boolean"
    },
    "USNM_ONPREM_RELEASE_HOST": {
      "x-usnm-visibility": "private",
      "description": "Private: in the settings store, under the environment's label. The on-prem release container's Arc machine identity's object id (usnm-release-arcs-<env>).",
      "not": {}
    },
    "USNM_ONPREM_SERVING": {
      "x-usnm-visibility": "public",
      "type": "boolean"
    },
    "USNM_ONPREM_SERVING_HOST": {
      "x-usnm-visibility": "private",
      "description": "Private: in the settings store, under the environment's label. The on-prem serving container's Arc machine identity's object id (#955).",
      "not": {}
    },
    "USNM_PAGE_LANGUAGE": {
      "x-usnm-visibility": "public",
      "type": "boolean"
    },
    "USNM_PAGE_LANGUAGE_FILTER": {
      "x-usnm-visibility": "public",
      "type": "string"
    },
    "USNM_PARTITION_DECADE": {
      "x-usnm-visibility": "public",
      "type": "boolean"
    },
    "USNM_RETAIN_RAW": {
      "x-usnm-visibility": "public",
      "type": "boolean"
    },
    "USNM_SEARCHER_APP": {
      "x-usnm-visibility": "public",
      "type": "boolean"
    },
    "USNM_SEARCHER_APP_RETAIN": {
      "x-usnm-visibility": "public",
      "type": "boolean"
    },
    "USNM_SCHEDULED_INGEST_IMAGE_TAG": {
      "x-usnm-visibility": "public",
      "type": "string",
      "pattern": "^[A-Za-z0-9_][A-Za-z0-9_.-]{0,127}$",
      "description": "Primary ingest job ACR tag only; when omitted, follows USNM_IMAGE_TAG. Does not override backfill, sync or other ingest-image jobs."
    },
    "USNM_SEARCH_BACKEND": {
      "x-usnm-visibility": "public",
      "type": "string"
    },
    "USNM_SEARCH_CLUSTER": {
      "x-usnm-visibility": "public",
      "type": "boolean"
    },
    "USNM_SEARCH_CLUSTER_INDEXERS": {
      "x-usnm-visibility": "public",
      "type": "integer"
    },
    "USNM_SEARCH_CLUSTER_NODES": {
      "x-usnm-visibility": "public",
      "type": "integer"
    },
    "USNM_SEARCH_CLUSTER_NODE_VCPU": {
      "x-usnm-visibility": "public",
      "type": "integer"
    },
    "USNM_SEARCH_CLUSTER_RUNTIME_THREADS": {
      "x-usnm-visibility": "public",
      "type": "integer"
    },
    "USNM_SEARCH_CLUSTER_SEARCH_THREADS": {
      "x-usnm-visibility": "public",
      "type": "integer"
    },
    "USNM_SEARCH_CLUSTER_SPLIT_SEARCHES": {
      "x-usnm-visibility": "public",
      "type": "integer"
    },
    "USNM_SEARCH_COMPARE_TAGS": {
      "x-usnm-visibility": "public",
      "type": "string"
    },
    "USNM_SEARCH_LOCAL_CACHE_GIB": {
      "x-usnm-visibility": "public",
      "type": "integer"
    },
    "USNM_SEARCH_LOCAL_INDEX": {
      "x-usnm-visibility": "public",
      "type": "string"
    },
    "USNM_SEARCH_LOCAL_MODE": {
      "x-usnm-visibility": "public",
      "type": "string"
    },
    "USNM_SEARCH_LOG_READERS": {
      "x-usnm-visibility": "private",
      "description": "Private: in the settings store, under the environment's label. Entra principals that may read the search log.",
      "not": {}
    },
    "USNM_SEARCH_NFS_GIB": {
      "x-usnm-visibility": "public",
      "type": "integer"
    },
    "USNM_SERIALSET_JOB": {
      "x-usnm-visibility": "public",
      "type": "boolean"
    },
    "USNM_SERIALSET_ONPREM": {
      "x-usnm-visibility": "public",
      "type": "boolean"
    },
    "USNM_SERIALSET_RUNNER": {
      "x-usnm-visibility": "private",
      "description": "Private: in the settings store, under the environment's label. The on-prem Serial Set runner's identity's object id (an OCR node's Arc machine identity).",
      "not": {}
    },
    "USNM_SINGLE_TEXT_FIELD": {
      "x-usnm-visibility": "public",
      "type": "boolean"
    },
    "USNM_SITE_CERT_ID": {
      "x-usnm-visibility": "private",
      "description": "Private: in the settings store, under the environment's label. A managed certificate's resource id, which names the subscription.",
      "not": {}
    },
    "USNM_SPLIT_DOCS": {
      "x-usnm-visibility": "public",
      "type": "integer"
    },
    "USNM_USE_ACR": {
      "x-usnm-visibility": "public",
      "type": "boolean"
    },
    "USNM_VNET_ADDRESS_PREFIX": {
      "x-usnm-visibility": "private",
      "description": "Private: in the settings store, under the environment's label. The VNet's address space, an RFC 1918 block (no private addresses in the repository, #399).",
      "not": {}
    },
    "USNM_WRITER_INGEST": {
      "x-usnm-visibility": "public",
      "description": "The Quickwit writer's ingest API: v2 (Quickwit's default, at least once) or v1 (each accepted page once; the release restarts the writer for its final merges). docs/operations/rebuild-and-index-storage.md, \"Duplicate-safe ingest\" (#283).",
      "type": "string",
      "pattern": "^v[12]$"
    },
    "USNM_WWW_CERT_ID": {
      "x-usnm-visibility": "private",
      "description": "Private: in the settings store, under the environment's label. A managed certificate's resource id, which names the subscription.",
      "not": {}
    }
  }
}
