{
  "$schema": "./schema.json",
  "USNM_AMERICAN_STORIES": true,
  "USNM_AMERICAN_STORIES_SEARCH": true,
  "USNM_API_IMAGE_TAG": "13fb17890307f6cacf655c22fc30af08f669d573",
  "USNM_BOINC_CONTROLLER_ONPREM": true,
  "USNM_BOINC_GROUP": true,
  "USNM_BOINC_HANDOFF_IMAGE": "crusnmprodffapzy.azurecr.io/usnm-boinc-bridge@sha256:9fa05b185a8ae729b8f029c0dcfddeb46795588acb2b2fc82d2b90fa166aac42",
  "USNM_BOINC_SERVER_ONPREM": true,
  "USNM_BROWSE_PAGES": true,
  "USNM_BUDGET_START": "2026-10-01",
  "USNM_COSMOS_FREE_TIER": true,
  "USNM_DEDICATED_PROFILE": true,
  "USNM_DNS_ZONE": "usnewsmap.com",
  "USNM_GITHUB_REPO": "tgoodyear/usnewsmap.com",
  "USNM_INDEX_STORAGE": true,
  "USNM_INDEX_STORAGE_SERVE": false,
  "USNM_INGEST_FULL": true,
  "USNM_INGEST_JOBS": true,
  "USNM_INGEST_ON_DEDICATED": true,
  "USNM_JA_LATIN": true,
  "USNM_JA_OCR_JOB": false,
  "USNM_JA_OCR_ONPREM": true,
  "USNM_LAKE_BLOB_SOFT_DELETE_DAYS": 3,
  "USNM_OCR": false,
  "USNM_OCR_BULK_WINDOW": "1000",
  "USNM_OCR_LOCAL": true,
  "USNM_OCR_NODES": true,
  "USNM_OCR_SEED_LANGUAGES": "ger",
  "USNM_OCR_SEED_MAX_PAGES": "50000",
  "USNM_OCR_SEED_PLAN": "pilot-german-frak2021",
  "USNM_OCR_SEED_SOURCE": "fetched",
  "USNM_ONPREM_RELEASE": true,
  "USNM_PAGE_LANGUAGE": true,
  "USNM_PARTITION_DECADE": true,
  "USNM_SCHEDULED_INGEST_IMAGE_TAG": "d4b048c13249d709024591df9c92ae25e334e953",
  "USNM_SEARCHER_APP": true,
  "USNM_SEARCH_BACKEND": "quickwit",
  "USNM_SERIALSET_JOB": false,
  "USNM_SERIALSET_ONPREM": true,
  "USNM_SINGLE_TEXT_FIELD": true,
  "USNM_SPLIT_DOCS": 60000,
  "USNM_USE_ACR": true
}
