{
  "$schema": "./schema.json",
  "USNM_AMERICAN_STORIES": true,
  "USNM_AMERICAN_STORIES_SEARCH": true,
  "USNM_COSMOS_FREE_TIER": false,
  "USNM_DEDICATED_PROFILE": true,
  "USNM_GITHUB_REPO": "tgoodyear/usnewsmap.com",
  "USNM_INDEX_STORAGE": false,
  "USNM_INDEX_STORAGE_SERVE": false,
  "USNM_INGEST_FULL": true,
  "USNM_INGEST_JOBS": true,
  "USNM_INGEST_ON_DEDICATED": false,
  "USNM_INGEST_SCRATCH_GIB": 128,
  "USNM_LOG_DAILY_CAP_GB": "1",
  "USNM_PAGE_LANGUAGE": false,
  "USNM_PARTITION_DECADE": false,
  "USNM_RETAIN_RAW": false,
  "USNM_SEARCHER_APP": true,
  "USNM_SEARCH_BACKEND": "quickwit",
  "USNM_SEARCH_CLUSTER": true,
  "USNM_SEARCH_CLUSTER_INDEXERS": 1,
  "USNM_SEARCH_CLUSTER_NODES": 1,
  "USNM_SEARCH_CLUSTER_NODE_VCPU": 2,
  "USNM_SINGLE_TEXT_FIELD": false,
  "USNM_SPLIT_DOCS": 30000,
  "USNM_USE_ACR": true
}
